{
  "$schema": "../../../schemas/v043-characterization-receipt.schema.json",
  "schema_version": "fiet-rindexer-v043-characterization-receipt/v1",
  "sealed_at": "2026-08-25T08:00:30Z",
  "canonical_source": {
    "repository": "https://github.com/joshstevens19/rindexer",
    "tag": "v0.43.0",
    "commit": "4f441289b83855c357239d2729fb725a56c3060b",
    "tree": "80a2698f6be13949d84d920b01c02125af598d09",
    "runtime_paths": [
      "Cargo.toml",
      "Cargo.lock",
      "core/Cargo.toml",
      "core/src"
    ],
    "runtime_paths_byte_identical": true
  },
  "toolchain": {
    "target": "x86_64-unknown-linux-gnu",
    "rustc": "rustc 1.97.0 (2d8144b78 2026-07-07)",
    "cargo": "cargo 1.97.0 (c980f4866 2026-06-30)",
    "cargo_nextest": "cargo-nextest 0.9.143 (60fa45f63 2026-08-04)"
  },
  "qualification_runs": [
    {
      "kind": "source_characterization",
      "command": "python3 -m unittest scripts/test_characterize_v043_baseline.py",
      "result": "pass",
      "passed": 6,
      "failed": 0
    },
    {
      "kind": "strict_clippy",
      "command": "cargo clippy --workspace --all-targets -- -D warnings",
      "result": "pass",
      "toolchain": "1.97.0"
    },
    {
      "kind": "library_unit_suite",
      "command": "cargo nextest run -p rindexer --lib",
      "result": "pass",
      "nextest_run_id": "042c87c8-a905-46bf-a9fc-bc7332be4fac",
      "passed": 765,
      "failed": 0,
      "skipped": 4,
      "test_seconds": 58.715
    },
    {
      "kind": "public_api_semantics",
      "command": "cargo test --locked --manifest-path characterization/v0.43/public-api-probe/Cargo.toml",
      "result": "pass",
      "passed": 6,
      "failed": 0,
      "dependency_baseline": "canonical Cargo.lock Alloy 2.0.4"
    },
    {
      "kind": "process_lifecycle",
      "command": "python3 scripts/characterize_v043_process.py --binary target/debug/rindexer_cli --anvil $(command -v anvil) --output characterization/v0.43/vanilla-baseline-process-receipt.json",
      "result": "pass",
      "signals": [
        "SIGTERM",
        "SIGINT",
        "SIGQUIT"
      ],
      "default_health_port": 8080,
      "watch": false,
      "receipt": "characterization/v0.43/vanilla-baseline-process-receipt.json",
      "receipt_sha256": "c6e9909fb061d80fa50c26dcfc183e75d6074f15dc31a677e01e806aff7c8027"
    },
    {
      "kind": "postgres_atomic_cursor_failure_injection",
      "command": "cargo nextest run -p rindexer --test postgres_atomic_cursor",
      "result": "pass",
      "nextest_run_id": "b5d80fbe-8498-44ab-88c0-c6976d3bc6ec",
      "passed": 3,
      "failed": 0
    },
    {
      "kind": "legacy_rust_callback_crash_window",
      "command": "cargo test --locked --manifest-path characterization/v0.43/public-api-probe/Cargo.toml --test legacy_callback",
      "result": "pass",
      "passed": 1,
      "failed": 0,
      "receipt": "characterization/v0.43/vanilla-baseline-failure-injection-receipt.json",
      "receipt_sha256": "3b28576ea9fa583b931972472ae5070abc828077a492bb9ff8d75813507c6158"
    },
    {
      "kind": "canonical_ci_toolchain_drift_characterization",
      "command": "GitHub Actions CI workflow_dispatch on exact canonical fiet/v0.43 before toolchain pin",
      "result": "expected_diagnostic_failure",
      "workflow_url": "https://github.com/usherlabs/rindexer/actions/runs/32818140552",
      "toolchain": "stable resolved to Rust 1.98.0",
      "failure": "12 pre-existing result_large_err diagnostics promoted by -D warnings",
      "runtime_regression": false
    },
    {
      "kind": "workspace_default_features",
      "command": "cargo nextest run --exclude rindexer_rust_playground --workspace",
      "result": "pass",
      "evidence_commit": "2feae06b78fa57c2c0f8d5953335c4700097262a",
      "runtime_paths_byte_identical_to_canonical": true,
      "workflow_url": "https://github.com/usherlabs/rindexer/actions/runs/32822736009",
      "job_url": "https://github.com/usherlabs/rindexer/actions/runs/32822736009/job/97725882576",
      "passed": 876,
      "failed": 0,
      "skipped": 4,
      "test_seconds": 140.273
    },
    {
      "kind": "workspace_all_features",
      "command": "cargo nextest run --exclude rindexer_rust_playground --workspace --all-features",
      "result": "pass",
      "evidence_commit": "2feae06b78fa57c2c0f8d5953335c4700097262a",
      "runtime_paths_byte_identical_to_canonical": true,
      "workflow_url": "https://github.com/usherlabs/rindexer/actions/runs/32822736009",
      "job_url": "https://github.com/usherlabs/rindexer/actions/runs/32822736009/job/97725882576",
      "passed": 888,
      "failed": 0,
      "skipped": 4,
      "test_seconds": 130.776
    },
    {
      "kind": "docker_e2e",
      "command": "cargo run --bin e2e-tests -- --rindexer-binary target/release/rindexer_cli",
      "result": "pass",
      "evidence_commit": "2feae06b78fa57c2c0f8d5953335c4700097262a",
      "runtime_paths_byte_identical_to_canonical": true,
      "workflow_url": "https://github.com/usherlabs/rindexer/actions/runs/32822735979",
      "job_url": "https://github.com/usherlabs/rindexer/actions/runs/32822735979/job/97724177010",
      "passed": 30,
      "failed": 0,
      "total": 32,
      "suite_result": "1 passed, 1 total"
    }
  ],
  "artifacts": {
    "source_receipt": {
      "path": "characterization/v0.43/vanilla-baseline-source-receipt.json",
      "sha256": "fca0180041950b2db68fcf629c71b756c4cf1ad5adcf124b0489182812461c82"
    },
    "process_receipt": {
      "path": "characterization/v0.43/vanilla-baseline-process-receipt.json",
      "sha256": "c6e9909fb061d80fa50c26dcfc183e75d6074f15dc31a677e01e806aff7c8027"
    },
    "failure_injection_receipt": {
      "path": "characterization/v0.43/vanilla-baseline-failure-injection-receipt.json",
      "sha256": "3b28576ea9fa583b931972472ae5070abc828077a492bb9ff8d75813507c6158"
    },
    "test_results": {
      "path": "characterization/v0.43/vanilla-baseline-test-results.json",
      "sha256": "b904065d0267437e6e136f2acb78cf940ae819eef63b648c62394c6774439fb4"
    }
  },
  "verdict": "characterized",
  "release_authorized": false
}
